{
  "$schema": "../design-object-set.schema.json",
  "object_set_id": "link-index-mobile-first.palette.v1",
  "version": 1,
  "status": "implemented",
  "template_id": "link-index-mobile-first",
  "kind": "palette",
  "source_refs": [
    "src/design-templates/pitches/examples/jnap-link-index-mobile-first.one-pager.json",
    "src/design-templates/contracts/link-index-mobile-first.contract.json"
  ],
  "metadata": {
    "token_ref": "src/design-templates/design-objects/link-index-mobile-first/tokens/color.tokens.json",
    "contrast_pairs": [
      {
        "foreground": "color.text.primary",
        "background": "color.surface.page",
        "minimum_ratio": 4.5
      },
      {
        "foreground": "color.text.primary",
        "background": "color.surface.object",
        "minimum_ratio": 4.5
      },
      {
        "foreground": "color.accent.primary",
        "background": "color.surface.page",
        "minimum_ratio": 4.5
      }
    ]
  },
  "objects": [
    {
      "id": "color.surface.page",
      "type": "color",
      "name": "Warm Background",
      "purpose": "Warm Background token for Link Index Mobile First.",
      "status": "implemented",
      "value": "#F5F2EC",
      "css_variable": "--bg",
      "usage": [
        "template CSS",
        "preview QA"
      ]
    },
    {
      "id": "color.surface.object",
      "type": "color",
      "name": "Soft Upper Surface",
      "purpose": "Soft Upper Surface token for Link Index Mobile First.",
      "status": "implemented",
      "value": "#FDFBF7",
      "css_variable": "--upper-bg",
      "usage": [
        "template CSS",
        "preview QA"
      ]
    },
    {
      "id": "color.text.primary",
      "type": "color",
      "name": "Ink",
      "purpose": "Ink token for Link Index Mobile First.",
      "status": "implemented",
      "value": "#0F100F",
      "css_variable": "--ink",
      "usage": [
        "template CSS",
        "preview QA"
      ]
    },
    {
      "id": "color.text.secondary",
      "type": "color",
      "name": "Soft Ink",
      "purpose": "Soft Ink token for Link Index Mobile First.",
      "status": "implemented",
      "value": "#0F100F",
      "css_variable": "--ink-soft",
      "usage": [
        "template CSS",
        "preview QA"
      ]
    },
    {
      "id": "color.accent.primary",
      "type": "color",
      "name": "Living Green",
      "purpose": "Living Green token for Link Index Mobile First.",
      "status": "implemented",
      "value": "#0F7C66",
      "css_variable": "--accent",
      "usage": [
        "template CSS",
        "preview QA"
      ]
    },
    {
      "id": "color.line.soft",
      "type": "color",
      "name": "Soft Line",
      "purpose": "Soft Line token for Link Index Mobile First.",
      "status": "implemented",
      "value": "#0F100F",
      "css_variable": "--line",
      "usage": [
        "template CSS",
        "preview QA"
      ]
    }
  ],
  "build_rules": [
    "Update this design object before changing equivalent template CSS."
  ],
  "qa_gates": [
    "contrast_readable"
  ]
}
