{
  "$schema": "../design-object-set.schema.json",
  "object_set_id": "internet-foyer.accessibility.v1",
  "version": 1,
  "status": "implemented",
  "template_id": "internet-foyer-index",
  "kind": "accessibility",
  "source_refs": [
    "src/design-templates/pitches/examples/jnap-internet-foyer.one-pager.json"
  ],
  "objects": [
    {
      "id": "accessibility.focus",
      "type": "accessibility_rule",
      "name": "Visible Focus",
      "purpose": "Keyboard navigation clarity.",
      "status": "implemented",
      "selector": ".foyer-route:focus-visible",
      "requirements": [
        "Focus ring visible on every route object.",
        "Focus indication must not rely on motion alone."
      ],
      "metadata": {
        "machine_checks": [
          {
            "id": "focus-selector-required",
            "type": "selector_required",
            "selector": ".foyer-route:focus-visible"
          }
        ]
      }
    },
    {
      "id": "accessibility.tap_targets",
      "type": "accessibility_rule",
      "name": "Comfortable Tap Targets",
      "purpose": "Mobile-first usability.",
      "status": "implemented",
      "requirements": [
        "Route objects are at least 44px high.",
        "Route objects have enough spacing to avoid accidental taps."
      ],
      "metadata": {
        "machine_checks": [
          {
            "id": "route-target-minimum",
            "type": "tap_target_minimum",
            "selector": ".foyer-route",
            "minimum_px": 44
          }
        ]
      }
    },
    {
      "id": "accessibility.motion",
      "type": "accessibility_rule",
      "name": "Reduced Motion",
      "purpose": "Motion safety.",
      "status": "implemented",
      "selector": "@media (prefers-reduced-motion: reduce)",
      "requirements": [
        "Disable or simplify object movement.",
        "All routes remain visible and usable without animation."
      ],
      "metadata": {
        "machine_checks": [
          {
            "id": "reduced-motion-query-required",
            "type": "selector_required",
            "selector": "@media (prefers-reduced-motion: reduce)"
          }
        ]
      }
    },
    {
      "id": "accessibility.structure",
      "type": "accessibility_rule",
      "name": "Semantic Structure",
      "purpose": "Preserve structure while hiding visible category headings.",
      "status": "implemented",
      "requirements": [
        "The main identity has a single h1.",
        "Route clusters use aria-label when visible headings are removed.",
        "Links retain readable labels."
      ],
      "metadata": {
        "machine_checks": [
          {
            "id": "single-h1",
            "type": "semantic_rule",
            "expectation": "exactly_one_h1"
          },
          {
            "id": "cluster-aria-label",
            "type": "attribute_required",
            "selector": ".foyer-cluster",
            "attribute": "aria-label"
          }
        ]
      }
    }
  ],
  "build_rules": [
    "Accessibility rules are not optional visual polish.",
    "Screenshots do not replace keyboard and semantic checks."
  ],
  "qa_gates": [
    "keyboard_focus_visible",
    "tap_target_review",
    "reduced_motion_acceptable",
    "logical_heading_structure"
  ]
}
