{
  "$schema": "../design-object-set.schema.json",
  "object_set_id": "link-index-mobile-first.motion.v1",
  "version": 1,
  "status": "implemented",
  "template_id": "link-index-mobile-first",
  "kind": "motion",
  "source_refs": [
    "src/design-templates/pitches/examples/jnap-link-index-mobile-first.one-pager.json",
    "src/design-templates/contracts/link-index-mobile-first.contract.json"
  ],
  "objects": [
    {
      "id": "motion.interaction.hover",
      "type": "motion_rule",
      "name": "Hover and Focus Motion",
      "purpose": "Small interaction response without carrying meaning.",
      "status": "implemented",
      "requirements": [
        "subtle hover/focus transition only",
        "reduced-motion-safe by global reset"
      ]
    },
    {
      "id": "motion.reduced",
      "type": "motion_rule",
      "name": "Reduced Motion",
      "purpose": "Respect reduced-motion preferences.",
      "status": "implemented",
      "requirements": [
        "Template remains usable without motion.",
        "Hover/focus meaning must remain visible."
      ]
    }
  ],
  "build_rules": [
    "Update this design object before changing equivalent template CSS."
  ],
  "qa_gates": [
    "reduced_motion_acceptable"
  ]
}
